{
  "structure": "case",
  "returnType": "text",
  "ruleType": "Transformation",
  "uuId": "bbbbbbbb-2222-3333-4444-000000000002",
  "version": 1,
  "metadata": {
    "id": "CASE_EXPRESSION",
    "description": "Comprehensive case expression demonstrating all operators, functions, nested structures, and expression groups"
  },
  "content": {
    "whenClauses": [
      {
        "resultName": "High Value with Complex Math",
        "when": {
          "type": "conditionGroup",
          "returnType": "boolean",
          "name": "Complex Math and Text Conditions",
          "conjunction": "AND",
          "not": false,
          "conditions": [
            {
              "type": "condition",
              "id": "case-cond-1",
              "returnType": "boolean",
              "name": "Nested Function Greater Than",
              "left": {
                "source": "expressionGroup",
                "returnType": "number",
                "expressions": [
                  {
                    "source": "function",
                    "returnType": "number",
                    "function": {
                      "name": "MATH.ROUND",
                      "args": [
                        {
                          "name": "value",
                          "value": {
                            "source": "expressionGroup",
                            "returnType": "number",
                            "expressions": [
                              {
                                "source": "function",
                                "returnType": "number",
                                "function": {
                                  "name": "MATH.MULTIPLY",
                                  "args": [
                                    {
                                      "name": "arg1",
                                      "value": {
                                        "source": "expressionGroup",
                                        "returnType": "number",
                                        "expressions": [
                                          {
                                            "source": "field",
                                            "returnType": "number",
                                            "field": "TABLE1.NUMBER_FIELD_01"
                                          }
                                        ],
                                        "operators": []
                                      }
                                    },
                                    {
                                      "name": "arg2",
                                      "value": {
                                        "source": "expressionGroup",
                                        "returnType": "number",
                                        "expressions": [
                                          {
                                            "source": "value",
                                            "returnType": "number",
                                            "value": 1.15
                                          }
                                        ],
                                        "operators": []
                                      }
                                    }
                                  ]
                                }
                              }
                            ],
                            "operators": []
                          }
                        },
                        {
                          "name": "decimals",
                          "value": {
                            "source": "expressionGroup",
                            "returnType": "number",
                            "expressions": [
                              {
                                "source": "value",
                                "returnType": "number",
                                "value": 2
                              }
                            ],
                            "operators": []
                          }
                        }
                      ]
                    }
                  }
                ],
                "operators": []
              },
              "operator": "greater",
              "right": {
                "source": "expressionGroup",
                "returnType": "number",
                "expressions": [
                  {
                    "source": "value",
                    "returnType": "number",
                    "value": 1000
                  }
                ],
                "operators": []
              }
            },
            {
              "type": "condition",
              "id": "case-cond-2",
              "returnType": "boolean",
              "name": "Text Not Contains",
              "left": {
                "source": "expressionGroup",
                "returnType": "text",
                "expressions": [
                  {
                    "source": "field",
                    "returnType": "text",
                    "field": "TABLE1.TEXT_FIELD_01"
                  }
                ],
                "operators": []
              },
              "operator": "not_contains",
              "right": {
                "source": "expressionGroup",
                "returnType": "text",
                "expressions": [
                  {
                    "source": "value",
                    "returnType": "text",
                    "value": "EXCLUDE"
                  }
                ],
                "operators": []
              }
            }
          ]
        },
        "then": {
          "source": "expressionGroup",
          "returnType": "text",
          "expressions": [
            {
              "source": "function",
              "returnType": "text",
              "function": {
                "name": "TEXT.CONCAT",
                "args": [
                  {
                    "name": "arg1",
                    "value": {
                      "source": "expressionGroup",
                      "returnType": "text",
                      "expressions": [
                        {
                          "source": "value",
                          "returnType": "text",
                          "value": "HIGH_VALUE_"
                        }
                      ],
                      "operators": []
                    }
                  },
                  {
                    "name": "arg2",
                    "value": {
                      "source": "expressionGroup",
                      "returnType": "text",
                      "expressions": [
                        {
                          "source": "field",
                          "returnType": "text",
                          "field": "TABLE1.TEXT_FIELD_02"
                        }
                      ],
                      "operators": []
                    }
                  }
                ]
              }
            }
          ],
          "operators": []
        }
      },
      {
        "resultName": "Medium Range with Date Check",
        "when": {
          "type": "conditionGroup",
          "returnType": "boolean",
          "name": "Range and Date Validations",
          "conjunction": "OR",
          "not": false,
          "conditions": [
            {
              "type": "condition",
              "id": "case-cond-3",
              "returnType": "boolean",
              "name": "Value Between Range",
              "left": {
                "source": "expressionGroup",
                "returnType": "number",
                "expressions": [
                  {
                    "source": "function",
                    "returnType": "number",
                    "function": {
                      "name": "MATH.ADD",
                      "args": [
                        {
                          "name": "arg1",
                          "value": {
                            "source": "expressionGroup",
                            "returnType": "number",
                            "expressions": [
                              {
                                "source": "field",
                                "returnType": "number",
                                "field": "TABLE2.NUMBER_FIELD_01"
                              }
                            ],
                            "operators": []
                          }
                        },
                        {
                          "name": "arg2",
                          "value": {
                            "source": "expressionGroup",
                            "returnType": "number",
                            "expressions": [
                              {
                                "source": "field",
                                "returnType": "number",
                                "field": "TABLE2.NUMBER_FIELD_02"
                              }
                            ],
                            "operators": []
                          }
                        }
                      ]
                    }
                  }
                ],
                "operators": []
              },
              "operator": "between",
              "right": [
                {
                  "source": "expressionGroup",
                  "returnType": "number",
                  "expressions": [
                    {
                      "source": "value",
                      "returnType": "number",
                      "value": 100
                    }
                  ],
                  "operators": []
                },
                {
                  "source": "expressionGroup",
                  "returnType": "number",
                  "expressions": [
                    {